[
  {
    "id": "warrior",
    "name": "Warrior",
    "description": "A frontline fighter built for direct combat.",
    "baseStatModifiers": {
      "strength": 1.2,
      "agility": 1.0,
      "intelligence": 0.8,
      "charisma": 0.9,
      "endurance": 1.3,
      "perception": 1.0,
      "luck": 1.0
    },
    "derivedStatModifiers": {
      "hp": 1.2,
      "attack": 1.15,
      "defense": 1.1,
      "speed": 0.95
    },
    "stanceAffinity": {
      "aggressive": 1.1,
      "balanced": 1.0,
      "defensive": 1.15
    },
    "startingWeaponTags": ["sword", "axe", "shield"],
    "startingArmorTags": ["medium", "heavy"],
    "skillIds": [
      "slash",
      "block",
      "heavy_strike",
      "iron_guard",
      "war_cry"
    ],
    "passives": [
      {
        "id": "battle_hardened",
        "name": "Battle Hardened",
        "effect": "Reduce damage taken by 5% when HP is below 50%"
      }
    ],
    "tags": ["melee", "tank", "balanced"]
  },
  {
    "id": "mage",
    "name": "Mage",
    "description": "A spellcaster who wields destructive magic.",
    "baseStatModifiers": {
      "strength": 0.6,
      "agility": 0.9,
      "intelligence": 1.6,
      "charisma": 1.2,
      "endurance": 0.7,
      "perception": 1.2,
      "luck": 1.0
    },
    "derivedStatModifiers": {
      "hp": 0.8,
      "attack": 0.7,
      "defense": 0.7,
      "speed": 1.0
    },
    "stanceAffinity": {
      "aggressive": 1.2,
      "balanced": 1.0,
      "defensive": 0.9
    },
    "startingWeaponTags": ["staff", "dagger"],
    "startingArmorTags": ["cloth"],
    "skillIds": [
      "fireball",
      "frostbolt",
      "arcane_missile",
      "teleport",
      "mana_shield"
    ],
    "passives": [
      {
        "id": "arcane_mastery",
        "name": "Arcane Mastery",
        "effect": "Increase spell damage by 5%"
      }
    ],
    "tags": ["caster", "ranged", "burst"]
  },
  {
    "id": "rogue",
    "name": "Rogue",
    "description": "A stealthy opportunist who strikes from shadows.",
    "baseStatModifiers": {
      "strength": 0.9,
      "agility": 1.4,
      "intelligence": 0.9,
      "charisma": 1.0,
      "endurance": 0.9,
      "perception": 1.2,
      "luck": 0.9
    },
    "derivedStatModifiers": {
      "hp": 0.9,
      "attack": 1.2,
      "defense": 0.8,
      "speed": 1.3
    },
    "stanceAffinity": {
      "aggressive": 1.15,
      "balanced": 1.0,
      "defensive": 0.9
    },
    "startingWeaponTags": ["dagger", "shortsword"],
    "startingArmorTags": ["light"],
    "skillIds": [
      "backstab",
      "stealth",
      "eviscerate",
      "poison_blade",
      "shadow_step"
    ],
    "passives": [
      {
        "id": "assassins_mark",
        "name": "Assassin's Mark",
        "effect": "Critical hits deal 15% bonus damage"
      }
    ],
    "tags": ["melee", "stealth", "burst"]
  },
  {
    "id": "archer",
    "name": "Archer",
    "description": "A ranged specialist who picks off enemies from afar.",
    "baseStatModifiers": {
      "strength": 1.0,
      "agility": 1.3,
      "intelligence": 0.8,
      "charisma": 0.9,
      "endurance": 1.0,
      "perception": 1.3,
      "luck": 0.9
    },
    "derivedStatModifiers": {
      "hp": 1.0,
      "attack": 1.2,
      "defense": 0.9,
      "speed": 1.1
    },
    "stanceAffinity": {
      "aggressive": 1.1,
      "balanced": 1.05,
      "defensive": 0.95
    },
    "startingWeaponTags": ["bow", "crossbow"],
    "startingArmorTags": ["light", "medium"],
    "skillIds": [
      "aimed_shot",
      "multi_shot",
      "crippling_arrow",
      "rapid_fire",
      "eagle_eye"
    ],
    "passives": [
      {
        "id": "hawkeye",
        "name": "Hawkeye",
        "effect": "Increases critical chance by 5%"
      }
    ],
    "tags": ["ranged", "physical", "sustained"]
  },
  {
    "id": "cleric",
    "name": "Cleric",
    "description": "A divine spellcaster who heals allies and smites undead.",
    "baseStatModifiers": {
      "strength": 1.0,
      "agility": 0.8,
      "intelligence": 1.1,
      "charisma": 1.3,
      "endurance": 1.1,
      "perception": 0.9,
      "luck": 1.0
    },
    "derivedStatModifiers": {
      "hp": 1.1,
      "attack": 0.9,
      "defense": 1.0,
      "speed": 0.9
    },
    "stanceAffinity": {
      "aggressive": 0.9,
      "balanced": 1.1,
      "defensive": 1.2
    },
    "startingWeaponTags": ["mace", "flail"],
    "startingArmorTags": ["medium", "heavy"],
    "skillIds": [
      "heal",
      "smite",
      "bless",
      "shield_of_faith",
      "cleanse"
    ],
    "passives": [
      {
        "id": "divine_intervention",
        "name": "Divine Intervention",
        "effect": "When healing an ally below 25% HP, heal increased by 20%"
      }
    ],
    "tags": ["healer", "support", "holy"]
  },
  {
    "id": "paladin",
    "name": "Paladin",
    "description": "A holy knight combining martial prowess with divine protection.",
    "baseStatModifiers": {
      "strength": 1.2,
      "agility": 0.9,
      "intelligence": 0.9,
      "charisma": 1.2,
      "endurance": 1.3,
      "perception": 0.9,
      "luck": 0.8
    },
    "derivedStatModifiers": {
      "hp": 1.3,
      "attack": 1.1,
      "defense": 1.2,
      "speed": 0.9
    },
    "stanceAffinity": {
      "aggressive": 0.95,
      "balanced": 1.1,
      "defensive": 1.2
    },
    "startingWeaponTags": ["sword", "mace", "shield"],
    "startingArmorTags": ["heavy"],
    "skillIds": [
      "holy_strike",
      "divine_shield",
      "lay_on_hands",
      "judgment",
      "aura_of_protection"
    ],
    "passives": [
      {
        "id": "righteous_defense",
        "name": "Righteous Defense",
        "effect": "Reduces damage taken by 10% when using defensive stance"
      }
    ],
    "tags": ["tank", "holy", "support"]
  },
  {
    "id": "assassin",
    "name": "Assassin",
    "description": "A deadly killer specializing in single-target elimination.",
    "baseStatModifiers": {
      "strength": 1.1,
      "agility": 1.5,
      "intelligence": 0.7,
      "charisma": 0.8,
      "endurance": 0.8,
      "perception": 1.2,
      "luck": 1.1
    },
    "derivedStatModifiers": {
      "hp": 0.8,
      "attack": 1.3,
      "defense": 0.7,
      "speed": 1.4
    },
    "stanceAffinity": {
      "aggressive": 1.25,
      "balanced": 1.0,
      "defensive": 0.85
    },
    "startingWeaponTags": ["dagger", "katars"],
    "startingArmorTags": ["light"],
    "skillIds": [
      "assassinate",
      "shadow_cloak",
      "deadly_poison",
      "garrote",
      "vanish"
    ],
    "passives": [
      {
        "id": "lethality",
        "name": "Lethality",
        "effect": "Abilities from stealth deal 20% increased damage"
      }
    ],
    "tags": ["melee", "stealth", "burst"]
  },
  {
    "id": "druid",
    "name": "Druid",
    "description": "A nature spellcaster who shapeshifts and controls elements.",
    "baseStatModifiers": {
      "strength": 0.8,
      "agility": 1.0,
      "intelligence": 1.2,
      "charisma": 1.0,
      "endurance": 1.1,
      "perception": 1.1,
      "luck": 1.0
    },
    "derivedStatModifiers": {
      "hp": 1.1,
      "attack": 0.9,
      "defense": 1.0,
      "speed": 1.0
    },
    "stanceAffinity": {
      "aggressive": 1.05,
      "balanced": 1.1,
      "defensive": 1.05
    },
    "startingWeaponTags": ["staff", "sickle"],
    "startingArmorTags": ["leather", "cloth"],
    "skillIds": [
      "wrath",
      "rejuvenation",
      "entangling_roots",
      "bear_form",
      "cyclone"
    ],
    "passives": [
      {
        "id": "wild_regeneration",
        "name": "Wild Regeneration",
        "effect": "Passively regenerate 2% HP per turn when in combat"
      }
    ],
    "tags": ["caster", "hybrid", "support"]
  },
  {
    "id": "bard",
    "name": "Bard",
    "description": "A musical support class that inspires allies and confuses foes.",
    "baseStatModifiers": {
      "strength": 0.8,
      "agility": 1.1,
      "intelligence": 1.0,
      "charisma": 1.5,
      "endurance": 0.9,
      "perception": 1.0,
      "luck": 0.9
    },
    "derivedStatModifiers": {
      "hp": 0.9,
      "attack": 0.8,
      "defense": 0.8,
      "speed": 1.2
    },
    "stanceAffinity": {
      "aggressive": 1.0,
      "balanced": 1.2,
      "defensive": 1.0
    },
    "startingWeaponTags": ["rapier", "dagger", "instrument"],
    "startingArmorTags": ["light"],
    "skillIds": [
      "inspire_courage",
      "soothing_melody",
      "mocking_ballad",
      "discordant_note",
      "encore"
    ],
    "passives": [
      {
        "id": "harmonious_aura",
        "name": "Harmonious Aura",
        "effect": "Nearby allies gain +5% to all stats"
      }
    ],
    "tags": ["support", "buffer", "control"]
  },
  {
    "id": "necromancer",
    "name": "Necromancer",
    "description": "A dark spellcaster who raises undead minions and siphons life.",
    "baseStatModifiers": {
      "strength": 0.7,
      "agility": 0.9,
      "intelligence": 1.6,
      "charisma": 0.8,
      "endurance": 0.8,
      "perception": 1.1,
      "luck": 1.3
    },
    "derivedStatModifiers": {
      "hp": 0.9,
      "attack": 0.7,
      "defense": 0.8,
      "speed": 1.0
    },
    "stanceAffinity": {
      "aggressive": 1.2,
      "balanced": 1.0,
      "defensive": 0.9
    },
    "startingWeaponTags": ["staff", "dagger"],
    "startingArmorTags": ["cloth"],
    "skillIds": [
      "raise_skeleton",
      "shadow_bolt",
      "life_drain",
      "curse_of_weakness",
      "corpse_explosion"
    ],
    "passives": [
      {
        "id": "undead_servant",
        "name": "Undead Servant",
        "effect": "When an enemy dies, summon a skeleton minion"
      }
    ],
    "tags": ["caster", "pet", "dot"]
  }
]